2024-06-23 18:18:48,672 [INFO] Trial 0 finished with value: 0.6400960188416877 and parameters: {'n_neighbors': 22, 'weights': 'uniform', 'metric': 'euclidean'}. Best is trial 0 with value: 0.6400960188416877.
2024-06-23 18:18:49,857 [INFO] Trial 1 finished with value: 0.775860957093302 and parameters: {'n_neighbors': 6, 'weights': 'distance', 'metric': 'minkowski'}. Best is trial 1 with value: 0.775860957093302.
2024-06-23 18:18:54,663 [INFO] Trial 2 finished with value: 0.8132685692486981 and parameters: {'n_neighbors': 8, 'weights': 'distance', 'metric': 'manhattan'}. Best is trial 2 with value: 0.8132685692486981.
2024-06-23 18:18:56,703 [INFO] Trial 3 finished with value: 0.6368205008117063 and parameters: {'n_neighbors': 23, 'weights': 'uniform', 'metric': 'euclidean'}. Best is trial 2 with value: 0.8132685692486981.
2024-06-23 18:18:57,949 [INFO] Trial 4 finished with value: 0.7607998918255936 and parameters: {'n_neighbors': 25, 'weights': 'distance', 'metric': 'minkowski'}. Best is trial 2 with value: 0.8132685692486981.
2024-06-23 18:19:01,919 [INFO] Trial 5 finished with value: 0.8060744698889503 and parameters: {'n_neighbors': 45, 'weights': 'distance', 'metric': 'manhattan'}. Best is trial 2 with value: 0.8132685692486981.
2024-06-23 18:19:06,432 [INFO] Trial 6 finished with value: 0.6686562876772025 and parameters: {'n_neighbors': 46, 'weights': 'uniform', 'metric': 'manhattan'}. Best is trial 2 with value: 0.8132685692486981.
2024-06-23 18:19:08,069 [INFO] Trial 7 finished with value: 0.6695755124404081 and parameters: {'n_neighbors': 12, 'weights': 'uniform', 'metric': 'euclidean'}. Best is trial 2 with value: 0.8132685692486981.
2024-06-23 18:19:12,932 [INFO] Trial 8 finished with value: 0.6833195233860387 and parameters: {'n_neighbors': 32, 'weights': 'uniform', 'metric': 'manhattan'}. Best is trial 2 with value: 0.8132685692486981.
2024-06-23 18:19:14,497 [INFO] Trial 9 finished with value: 0.7522285881511075 and parameters: {'n_neighbors': 46, 'weights': 'distance', 'metric': 'euclidean'}. Best is trial 2 with value: 0.8132685692486981.
2024-06-23 18:19:18,904 [INFO] Trial 10 finished with value: 0.8066257901597368 and parameters: {'n_neighbors': 3, 'weights': 'distance', 'metric': 'manhattan'}. Best is trial 2 with value: 0.8132685692486981.
2024-06-23 18:19:23,212 [INFO] Trial 11 finished with value: 0.8066257901597368 and parameters: {'n_neighbors': 3, 'weights': 'distance', 'metric': 'manhattan'}. Best is trial 2 with value: 0.8132685692486981.
2024-06-23 18:19:27,602 [INFO] Trial 12 finished with value: 0.8143398510193662 and parameters: {'n_neighbors': 14, 'weights': 'distance', 'metric': 'manhattan'}. Best is trial 12 with value: 0.8143398510193662.
2024-06-23 18:19:31,942 [INFO] Trial 13 finished with value: 0.8140644579465668 and parameters: {'n_neighbors': 16, 'weights': 'distance', 'metric': 'manhattan'}. Best is trial 12 with value: 0.8143398510193662.
2024-06-23 18:19:36,513 [INFO] Trial 14 finished with value: 0.8140644579465668 and parameters: {'n_neighbors': 16, 'weights': 'distance', 'metric': 'manhattan'}. Best is trial 12 with value: 0.8143398510193662.
2024-06-23 18:19:41,405 [INFO] Trial 15 finished with value: 0.8095643970141279 and parameters: {'n_neighbors': 33, 'weights': 'distance', 'metric': 'manhattan'}. Best is trial 12 with value: 0.8143398510193662.
2024-06-23 18:19:42,754 [INFO] Trial 16 finished with value: 0.7686364969333951 and parameters: {'n_neighbors': 16, 'weights': 'distance', 'metric': 'minkowski'}. Best is trial 12 with value: 0.8143398510193662.
2024-06-23 18:19:51,189 [INFO] Trial 17 finished with value: 0.8133909073432889 and parameters: {'n_neighbors': 17, 'weights': 'distance', 'metric': 'manhattan'}. Best is trial 12 with value: 0.8143398510193662.
2024-06-23 18:19:59,830 [INFO] Trial 18 finished with value: 0.8092888914939206 and parameters: {'n_neighbors': 34, 'weights': 'distance', 'metric': 'manhattan'}. Best is trial 12 with value: 0.8143398510193662.
2024-06-23 18:20:02,653 [INFO] Trial 19 finished with value: 0.7701059784023201 and parameters: {'n_neighbors': 11, 'weights': 'distance', 'metric': 'minkowski'}. Best is trial 12 with value: 0.8143398510193662.
2024-06-23 18:20:09,572 [INFO] Trial 20 finished with value: 0.8128093012372822 and parameters: {'n_neighbors': 19, 'weights': 'distance', 'metric': 'manhattan'}. Best is trial 12 with value: 0.8143398510193662.
2024-06-23 18:20:14,009 [INFO] Trial 21 finished with value: 0.8147684958533379 and parameters: {'n_neighbors': 13, 'weights': 'distance', 'metric': 'manhattan'}. Best is trial 21 with value: 0.8147684958533379.
2024-06-23 18:20:18,007 [INFO] Trial 22 finished with value: 0.8146766919153267 and parameters: {'n_neighbors': 12, 'weights': 'distance', 'metric': 'manhattan'}. Best is trial 21 with value: 0.8147684958533379.
2024-06-23 18:20:22,169 [INFO] Trial 23 finished with value: 0.8137888587201865 and parameters: {'n_neighbors': 11, 'weights': 'distance', 'metric': 'manhattan'}. Best is trial 21 with value: 0.8147684958533379.
2024-06-23 18:20:26,312 [INFO] Trial 24 finished with value: 0.8106051961666116 and parameters: {'n_neighbors': 28, 'weights': 'distance', 'metric': 'manhattan'}. Best is trial 21 with value: 0.8147684958533379.
2024-06-23 18:20:30,994 [INFO] Trial 25 finished with value: 0.8132685692486981 and parameters: {'n_neighbors': 8, 'weights': 'distance', 'metric': 'manhattan'}. Best is trial 21 with value: 0.8147684958533379.
2024-06-23 18:20:35,827 [INFO] Trial 26 finished with value: 0.7233912207904388 and parameters: {'n_neighbors': 12, 'weights': 'uniform', 'metric': 'manhattan'}. Best is trial 21 with value: 0.8147684958533379.
2024-06-23 18:20:39,785 [INFO] Trial 27 finished with value: 0.8128093012372822 and parameters: {'n_neighbors': 19, 'weights': 'distance', 'metric': 'manhattan'}. Best is trial 21 with value: 0.8147684958533379.
2024-06-23 18:20:41,097 [INFO] Trial 28 finished with value: 0.755442695840397 and parameters: {'n_neighbors': 38, 'weights': 'distance', 'metric': 'minkowski'}. Best is trial 21 with value: 0.8147684958533379.
2024-06-23 18:20:43,108 [INFO] Trial 29 finished with value: 0.6400960188416877 and parameters: {'n_neighbors': 22, 'weights': 'uniform', 'metric': 'euclidean'}. Best is trial 21 with value: 0.8147684958533379.
2024-06-23 18:20:44,494 [INFO] Trial 30 finished with value: 0.7598203202867634 and parameters: {'n_neighbors': 27, 'weights': 'distance', 'metric': 'euclidean'}. Best is trial 21 with value: 0.8147684958533379.
2024-06-23 18:20:49,020 [INFO] Trial 31 finished with value: 0.8143398510193662 and parameters: {'n_neighbors': 14, 'weights': 'distance', 'metric': 'manhattan'}. Best is trial 21 with value: 0.8147684958533379.
2024-06-23 18:20:54,371 [INFO] Trial 32 finished with value: 0.8147684958533379 and parameters: {'n_neighbors': 13, 'weights': 'distance', 'metric': 'manhattan'}. Best is trial 21 with value: 0.8147684958533379.
2024-06-23 18:21:02,444 [INFO] Trial 33 finished with value: 0.8121359848994375 and parameters: {'n_neighbors': 6, 'weights': 'distance', 'metric': 'manhattan'}. Best is trial 21 with value: 0.8147684958533379.
2024-06-23 18:21:10,523 [INFO] Trial 34 finished with value: 0.8132685692486981 and parameters: {'n_neighbors': 8, 'weights': 'distance', 'metric': 'manhattan'}. Best is trial 21 with value: 0.8147684958533379.
2024-06-23 18:21:18,433 [INFO] Trial 35 finished with value: 0.8113092340733825 and parameters: {'n_neighbors': 21, 'weights': 'distance', 'metric': 'manhattan'}. Best is trial 21 with value: 0.8147684958533379.
2024-06-23 18:21:20,848 [INFO] Trial 36 finished with value: 0.7717896581275511 and parameters: {'n_neighbors': 9, 'weights': 'distance', 'metric': 'minkowski'}. Best is trial 21 with value: 0.8147684958533379.
2024-06-23 18:21:30,598 [INFO] Trial 37 finished with value: 0.7236054003055101 and parameters: {'n_neighbors': 13, 'weights': 'uniform', 'metric': 'manhattan'}. Best is trial 21 with value: 0.8147684958533379.
2024-06-23 18:21:38,160 [INFO] Trial 38 finished with value: 0.8038398728294782 and parameters: {'n_neighbors': 50, 'weights': 'distance', 'metric': 'manhattan'}. Best is trial 21 with value: 0.8147684958533379.
2024-06-23 18:21:39,518 [INFO] Trial 39 finished with value: 0.7619325370838668 and parameters: {'n_neighbors': 24, 'weights': 'distance', 'metric': 'euclidean'}. Best is trial 21 with value: 0.8147684958533379.
2024-06-23 18:21:44,120 [INFO] Trial 40 finished with value: 0.7370748053101976 and parameters: {'n_neighbors': 7, 'weights': 'uniform', 'metric': 'manhattan'}. Best is trial 21 with value: 0.8147684958533379.
2024-06-23 18:21:48,158 [INFO] Trial 41 finished with value: 0.8128093012372822 and parameters: {'n_neighbors': 19, 'weights': 'distance', 'metric': 'manhattan'}. Best is trial 21 with value: 0.8147684958533379.
2024-06-23 18:21:53,025 [INFO] Trial 42 finished with value: 0.8147684958533379 and parameters: {'n_neighbors': 13, 'weights': 'distance', 'metric': 'manhattan'}. Best is trial 21 with value: 0.8147684958533379.
2024-06-23 18:21:57,565 [INFO] Trial 43 finished with value: 0.8143398510193662 and parameters: {'n_neighbors': 14, 'weights': 'distance', 'metric': 'manhattan'}. Best is trial 21 with value: 0.8147684958533379.
2024-06-23 18:22:01,623 [INFO] Trial 44 finished with value: 0.8117380194666142 and parameters: {'n_neighbors': 5, 'weights': 'distance', 'metric': 'manhattan'}. Best is trial 21 with value: 0.8147684958533379.
2024-06-23 18:22:05,972 [INFO] Trial 45 finished with value: 0.813758333934224 and parameters: {'n_neighbors': 10, 'weights': 'distance', 'metric': 'manhattan'}. Best is trial 21 with value: 0.8147684958533379.
2024-06-23 18:22:10,929 [INFO] Trial 46 finished with value: 0.8143398510193662 and parameters: {'n_neighbors': 14, 'weights': 'distance', 'metric': 'manhattan'}. Best is trial 21 with value: 0.8147684958533379.
2024-06-23 18:22:12,266 [INFO] Trial 47 finished with value: 0.7660039391264083 and parameters: {'n_neighbors': 18, 'weights': 'distance', 'metric': 'euclidean'}. Best is trial 21 with value: 0.8147684958533379.
2024-06-23 18:22:14,085 [INFO] Trial 48 finished with value: 0.7009222421019868 and parameters: {'n_neighbors': 5, 'weights': 'uniform', 'metric': 'minkowski'}. Best is trial 21 with value: 0.8147684958533379.
2024-06-23 18:22:19,138 [INFO] Trial 49 finished with value: 0.8113092340733825 and parameters: {'n_neighbors': 21, 'weights': 'distance', 'metric': 'manhattan'}. Best is trial 21 with value: 0.8147684958533379.
2024-06-23 18:22:19,156 [INFO] Best hyperparameters: {'n_neighbors': 13, 'weights': 'distance', 'metric': 'manhattan'}
2024-06-23 18:22:19,158 [INFO] Best value: 0.8147684958533379
2024-06-23 18:27:29,570 [INFO] Trial 0 finished with value: 0.6834725268258519 and parameters: {'n_neighbors': 33, 'weights': 'uniform', 'metric': 'manhattan'}. Best is trial 0 with value: 0.6834725268258519.
2024-06-23 18:27:31,418 [INFO] Trial 1 finished with value: 0.6906366730072949 and parameters: {'n_neighbors': 7, 'weights': 'uniform', 'metric': 'minkowski'}. Best is trial 1 with value: 0.6906366730072949.
2024-06-23 18:27:33,385 [INFO] Trial 2 finished with value: 0.6368205008117063 and parameters: {'n_neighbors': 23, 'weights': 'uniform', 'metric': 'minkowski'}. Best is trial 1 with value: 0.6906366730072949.
2024-06-23 18:27:34,917 [INFO] Trial 3 finished with value: 0.7566978244378297 and parameters: {'n_neighbors': 33, 'weights': 'distance', 'metric': 'euclidean'}. Best is trial 3 with value: 0.7566978244378297.
2024-06-23 18:27:36,377 [INFO] Trial 4 finished with value: 0.7701059784023201 and parameters: {'n_neighbors': 11, 'weights': 'distance', 'metric': 'minkowski'}. Best is trial 4 with value: 0.7701059784023201.
2024-06-23 18:27:37,628 [INFO] Trial 5 finished with value: 0.7767180312370465 and parameters: {'n_neighbors': 5, 'weights': 'distance', 'metric': 'minkowski'}. Best is trial 5 with value: 0.7767180312370465.
2024-06-23 18:27:38,819 [INFO] Trial 6 finished with value: 0.7767180312370465 and parameters: {'n_neighbors': 5, 'weights': 'distance', 'metric': 'minkowski'}. Best is trial 5 with value: 0.7767180312370465.
2024-06-23 18:27:40,675 [INFO] Trial 7 finished with value: 0.6143511988369565 and parameters: {'n_neighbors': 34, 'weights': 'uniform', 'metric': 'minkowski'}. Best is trial 5 with value: 0.7767180312370465.
2024-06-23 18:27:41,882 [INFO] Trial 8 finished with value: 0.7701059784023201 and parameters: {'n_neighbors': 11, 'weights': 'distance', 'metric': 'minkowski'}. Best is trial 5 with value: 0.7767180312370465.
2024-06-23 18:27:43,775 [INFO] Trial 9 finished with value: 0.6153613560707615 and parameters: {'n_neighbors': 33, 'weights': 'uniform', 'metric': 'minkowski'}. Best is trial 5 with value: 0.7767180312370465.
2024-06-23 18:27:45,523 [INFO] Trial 10 finished with value: 0.7531468477407277 and parameters: {'n_neighbors': 44, 'weights': 'distance', 'metric': 'euclidean'}. Best is trial 5 with value: 0.7767180312370465.
2024-06-23 18:27:49,857 [INFO] Trial 11 finished with value: 0.8066257901597368 and parameters: {'n_neighbors': 3, 'weights': 'distance', 'metric': 'manhattan'}. Best is trial 11 with value: 0.8066257901597368.
2024-06-23 18:27:54,006 [INFO] Trial 12 finished with value: 0.8133909073432889 and parameters: {'n_neighbors': 17, 'weights': 'distance', 'metric': 'manhattan'}. Best is trial 12 with value: 0.8133909073432889.
2024-06-23 18:27:58,501 [INFO] Trial 13 finished with value: 0.8128093012372822 and parameters: {'n_neighbors': 19, 'weights': 'distance', 'metric': 'manhattan'}. Best is trial 12 with value: 0.8133909073432889.
2024-06-23 18:28:03,154 [INFO] Trial 14 finished with value: 0.8120133235185488 and parameters: {'n_neighbors': 20, 'weights': 'distance', 'metric': 'manhattan'}. Best is trial 12 with value: 0.8133909073432889.
2024-06-23 18:28:07,516 [INFO] Trial 15 finished with value: 0.8145235619721796 and parameters: {'n_neighbors': 15, 'weights': 'distance', 'metric': 'manhattan'}. Best is trial 15 with value: 0.8145235619721796.
2024-06-23 18:28:11,750 [INFO] Trial 16 finished with value: 0.8145235619721796 and parameters: {'n_neighbors': 15, 'weights': 'distance', 'metric': 'manhattan'}. Best is trial 15 with value: 0.8145235619721796.
2024-06-23 18:28:15,799 [INFO] Trial 17 finished with value: 0.8145235619721796 and parameters: {'n_neighbors': 15, 'weights': 'distance', 'metric': 'manhattan'}. Best is trial 15 with value: 0.8145235619721796.
2024-06-23 18:28:20,131 [INFO] Trial 18 finished with value: 0.8110949889639896 and parameters: {'n_neighbors': 27, 'weights': 'distance', 'metric': 'manhattan'}. Best is trial 15 with value: 0.8145235619721796.
2024-06-23 18:28:24,267 [INFO] Trial 19 finished with value: 0.8120133328891661 and parameters: {'n_neighbors': 26, 'weights': 'distance', 'metric': 'manhattan'}. Best is trial 15 with value: 0.8145235619721796.
2024-06-23 18:28:25,410 [INFO] Trial 20 finished with value: 0.7708405457803618 and parameters: {'n_neighbors': 12, 'weights': 'distance', 'metric': 'euclidean'}. Best is trial 15 with value: 0.8145235619721796.
2024-06-23 18:28:29,411 [INFO] Trial 21 finished with value: 0.8145235619721796 and parameters: {'n_neighbors': 15, 'weights': 'distance', 'metric': 'manhattan'}. Best is trial 15 with value: 0.8145235619721796.
2024-06-23 18:28:33,500 [INFO] Trial 22 finished with value: 0.8143398510193662 and parameters: {'n_neighbors': 14, 'weights': 'distance', 'metric': 'manhattan'}. Best is trial 15 with value: 0.8145235619721796.
2024-06-23 18:28:37,495 [INFO] Trial 23 finished with value: 0.8110031428582003 and parameters: {'n_neighbors': 22, 'weights': 'distance', 'metric': 'manhattan'}. Best is trial 15 with value: 0.8145235619721796.
2024-06-23 18:28:41,495 [INFO] Trial 24 finished with value: 0.8038398728294782 and parameters: {'n_neighbors': 50, 'weights': 'distance', 'metric': 'manhattan'}. Best is trial 15 with value: 0.8145235619721796.
2024-06-23 18:28:45,693 [INFO] Trial 25 finished with value: 0.814554292911723 and parameters: {'n_neighbors': 9, 'weights': 'distance', 'metric': 'manhattan'}. Best is trial 25 with value: 0.814554292911723.
2024-06-23 18:28:51,030 [INFO] Trial 26 finished with value: 0.7268810073563563 and parameters: {'n_neighbors': 10, 'weights': 'uniform', 'metric': 'manhattan'}. Best is trial 25 with value: 0.814554292911723.
2024-06-23 18:28:52,230 [INFO] Trial 27 finished with value: 0.7717896581275511 and parameters: {'n_neighbors': 9, 'weights': 'distance', 'metric': 'euclidean'}. Best is trial 25 with value: 0.814554292911723.
2024-06-23 18:28:56,322 [INFO] Trial 28 finished with value: 0.8106051961666116 and parameters: {'n_neighbors': 28, 'weights': 'distance', 'metric': 'manhattan'}. Best is trial 25 with value: 0.814554292911723.
2024-06-23 18:29:01,787 [INFO] Trial 29 finished with value: 0.7137787806212448 and parameters: {'n_neighbors': 17, 'weights': 'uniform', 'metric': 'manhattan'}. Best is trial 25 with value: 0.814554292911723.
2024-06-23 18:29:05,842 [INFO] Trial 30 finished with value: 0.8145236509930441 and parameters: {'n_neighbors': 7, 'weights': 'distance', 'metric': 'manhattan'}. Best is trial 25 with value: 0.814554292911723.
2024-06-23 18:29:09,804 [INFO] Trial 31 finished with value: 0.8145236509930441 and parameters: {'n_neighbors': 7, 'weights': 'distance', 'metric': 'manhattan'}. Best is trial 25 with value: 0.814554292911723.
2024-06-23 18:29:13,668 [INFO] Trial 32 finished with value: 0.8145236509930441 and parameters: {'n_neighbors': 7, 'weights': 'distance', 'metric': 'manhattan'}. Best is trial 25 with value: 0.814554292911723.
2024-06-23 18:29:17,659 [INFO] Trial 33 finished with value: 0.8132685692486981 and parameters: {'n_neighbors': 8, 'weights': 'distance', 'metric': 'manhattan'}. Best is trial 25 with value: 0.814554292911723.
2024-06-23 18:29:22,210 [INFO] Trial 34 finished with value: 0.760676846249394 and parameters: {'n_neighbors': 3, 'weights': 'uniform', 'metric': 'manhattan'}. Best is trial 25 with value: 0.814554292911723.
2024-06-23 18:29:26,168 [INFO] Trial 35 finished with value: 0.8145236509930441 and parameters: {'n_neighbors': 7, 'weights': 'distance', 'metric': 'manhattan'}. Best is trial 25 with value: 0.814554292911723.
2024-06-23 18:29:27,292 [INFO] Trial 36 finished with value: 0.775860957093302 and parameters: {'n_neighbors': 6, 'weights': 'distance', 'metric': 'euclidean'}. Best is trial 25 with value: 0.814554292911723.
2024-06-23 18:29:31,395 [INFO] Trial 37 finished with value: 0.8066257901597368 and parameters: {'n_neighbors': 3, 'weights': 'distance', 'metric': 'manhattan'}. Best is trial 25 with value: 0.814554292911723.
2024-06-23 18:29:35,949 [INFO] Trial 38 finished with value: 0.7233912207904388 and parameters: {'n_neighbors': 12, 'weights': 'uniform', 'metric': 'manhattan'}. Best is trial 25 with value: 0.814554292911723.
2024-06-23 18:29:37,228 [INFO] Trial 39 finished with value: 0.773595605667743 and parameters: {'n_neighbors': 8, 'weights': 'distance', 'metric': 'euclidean'}. Best is trial 25 with value: 0.814554292911723.
2024-06-23 18:29:38,930 [INFO] Trial 40 finished with value: 0.775860957093302 and parameters: {'n_neighbors': 6, 'weights': 'distance', 'metric': 'minkowski'}. Best is trial 25 with value: 0.814554292911723.
2024-06-23 18:29:43,126 [INFO] Trial 41 finished with value: 0.8132685692486981 and parameters: {'n_neighbors': 8, 'weights': 'distance', 'metric': 'manhattan'}. Best is trial 25 with value: 0.814554292911723.
2024-06-23 18:29:47,288 [INFO] Trial 42 finished with value: 0.8117380194666142 and parameters: {'n_neighbors': 5, 'weights': 'distance', 'metric': 'manhattan'}. Best is trial 25 with value: 0.814554292911723.
2024-06-23 18:29:51,196 [INFO] Trial 43 finished with value: 0.8137888587201865 and parameters: {'n_neighbors': 11, 'weights': 'distance', 'metric': 'manhattan'}. Best is trial 25 with value: 0.814554292911723.
2024-06-23 18:29:55,329 [INFO] Trial 44 finished with value: 0.8121359848994375 and parameters: {'n_neighbors': 6, 'weights': 'distance', 'metric': 'manhattan'}. Best is trial 25 with value: 0.814554292911723.
2024-06-23 18:29:59,271 [INFO] Trial 45 finished with value: 0.8147684958533379 and parameters: {'n_neighbors': 13, 'weights': 'distance', 'metric': 'manhattan'}. Best is trial 45 with value: 0.8147684958533379.
2024-06-23 18:30:01,407 [INFO] Trial 46 finished with value: 0.6695755124404081 and parameters: {'n_neighbors': 12, 'weights': 'uniform', 'metric': 'minkowski'}. Best is trial 45 with value: 0.8147684958533379.
2024-06-23 18:30:06,096 [INFO] Trial 47 finished with value: 0.8071460608899903 and parameters: {'n_neighbors': 39, 'weights': 'distance', 'metric': 'manhattan'}. Best is trial 45 with value: 0.8147684958533379.
2024-06-23 18:30:11,111 [INFO] Trial 48 finished with value: 0.813758333934224 and parameters: {'n_neighbors': 10, 'weights': 'distance', 'metric': 'manhattan'}. Best is trial 45 with value: 0.8147684958533379.
2024-06-23 18:30:12,382 [INFO] Trial 49 finished with value: 0.7767792729066263 and parameters: {'n_neighbors': 3, 'weights': 'distance', 'metric': 'minkowski'}. Best is trial 45 with value: 0.8147684958533379.
2024-06-23 18:30:12,387 [INFO] Best hyperparameters: {'n_neighbors': 13, 'weights': 'distance', 'metric': 'manhattan'}
2024-06-23 18:30:12,387 [INFO] Best value: 0.8147684958533379
