2024-06-23 15:39:11,793 [INFO] Trial 20 finished with value: 0.8842566413430418 and parameters: {'n_estimators': 285, 'max_depth': 40, 'min_samples_split': 4, 'min_samples_leaf': 1, 'max_features': 'sqrt', 'bootstrap': False}. Best is trial 0 with value: 0.8845321609191752.
2024-06-23 15:39:59,049 [INFO] Trial 21 finished with value: 0.8843484968194485 and parameters: {'n_estimators': 286, 'max_depth': 40, 'min_samples_split': 4, 'min_samples_leaf': 1, 'max_features': 'sqrt', 'bootstrap': False}. Best is trial 0 with value: 0.8845321609191752.
2024-06-23 15:40:48,812 [INFO] Trial 22 finished with value: 0.8842260509627582 and parameters: {'n_estimators': 300, 'max_depth': 39, 'min_samples_split': 4, 'min_samples_leaf': 1, 'max_features': 'sqrt', 'bootstrap': False}. Best is trial 0 with value: 0.8845321609191752.
2024-06-23 15:41:35,475 [INFO] Trial 23 finished with value: 0.8845321609191752 and parameters: {'n_estimators': 272, 'max_depth': 40, 'min_samples_split': 4, 'min_samples_leaf': 1, 'max_features': 'sqrt', 'bootstrap': False}. Best is trial 0 with value: 0.8845321609191752.
2024-06-23 15:42:20,746 [INFO] Trial 24 finished with value: 0.8845933979034463 and parameters: {'n_estimators': 272, 'max_depth': 41, 'min_samples_split': 4, 'min_samples_leaf': 1, 'max_features': 'sqrt', 'bootstrap': False}. Best is trial 24 with value: 0.8845933979034463.
2024-06-23 15:43:02,185 [INFO] Trial 25 finished with value: 0.8775832062794755 and parameters: {'n_estimators': 272, 'max_depth': 42, 'min_samples_split': 4, 'min_samples_leaf': 2, 'max_features': 'sqrt', 'bootstrap': False}. Best is trial 24 with value: 0.8845933979034463.
2024-06-23 15:43:46,906 [INFO] Trial 26 finished with value: 0.8831852799221265 and parameters: {'n_estimators': 259, 'max_depth': 41, 'min_samples_split': 3, 'min_samples_leaf': 1, 'max_features': 'sqrt', 'bootstrap': False}. Best is trial 24 with value: 0.8845933979034463.
2024-06-23 15:44:29,707 [INFO] Trial 27 finished with value: 0.8842260509627582 and parameters: {'n_estimators': 250, 'max_depth': 33, 'min_samples_split': 4, 'min_samples_leaf': 1, 'max_features': 'sqrt', 'bootstrap': False}. Best is trial 24 with value: 0.8845933979034463.
2024-06-23 15:47:10,253 [INFO] Trial 28 finished with value: 0.8444920424951873 and parameters: {'n_estimators': 273, 'max_depth': 39, 'min_samples_split': 3, 'min_samples_leaf': 2, 'max_features': None, 'bootstrap': False}. Best is trial 24 with value: 0.8845933979034463.
2024-06-23 15:47:55,164 [INFO] Trial 29 finished with value: 0.8843485061900658 and parameters: {'n_estimators': 264, 'max_depth': 37, 'min_samples_split': 4, 'min_samples_leaf': 1, 'max_features': 'log2', 'bootstrap': False}. Best is trial 24 with value: 0.8845933979034463.
2024-06-23 15:48:37,721 [INFO] Trial 30 finished with value: 0.8845015799095088 and parameters: {'n_estimators': 258, 'max_depth': 41, 'min_samples_split': 4, 'min_samples_leaf': 1, 'max_features': 'sqrt', 'bootstrap': False}. Best is trial 24 with value: 0.8845933979034463.
2024-06-23 15:49:21,545 [INFO] Trial 31 finished with value: 0.8845015799095088 and parameters: {'n_estimators': 258, 'max_depth': 41, 'min_samples_split': 4, 'min_samples_leaf': 1, 'max_features': 'sqrt', 'bootstrap': False}. Best is trial 24 with value: 0.8845933979034463.
2024-06-23 15:50:07,053 [INFO] Trial 32 finished with value: 0.8845933697915941 and parameters: {'n_estimators': 276, 'max_depth': 43, 'min_samples_split': 4, 'min_samples_leaf': 1, 'max_features': 'sqrt', 'bootstrap': False}. Best is trial 24 with value: 0.8845933979034463.
2024-06-23 15:50:55,557 [INFO] Trial 33 finished with value: 0.8844403288693119 and parameters: {'n_estimators': 291, 'max_depth': 43, 'min_samples_split': 4, 'min_samples_leaf': 1, 'max_features': 'sqrt', 'bootstrap': False}. Best is trial 24 with value: 0.8845933979034463.
2024-06-23 15:51:39,527 [INFO] Trial 34 finished with value: 0.8774607604227853 and parameters: {'n_estimators': 279, 'max_depth': 44, 'min_samples_split': 4, 'min_samples_leaf': 2, 'max_features': 'sqrt', 'bootstrap': False}. Best is trial 24 with value: 0.8845933979034463.
2024-06-23 15:52:33,546 [INFO] Trial 35 finished with value: 0.883430166950198 and parameters: {'n_estimators': 271, 'max_depth': 39, 'min_samples_split': 3, 'min_samples_leaf': 1, 'max_features': 'sqrt', 'bootstrap': False}. Best is trial 24 with value: 0.8845933979034463.
2024-06-23 15:53:21,820 [INFO] Trial 36 finished with value: 0.8770934322233321 and parameters: {'n_estimators': 291, 'max_depth': 42, 'min_samples_split': 4, 'min_samples_leaf': 2, 'max_features': 'sqrt', 'bootstrap': False}. Best is trial 24 with value: 0.8845933979034463.
2024-06-23 15:54:14,606 [INFO] Trial 37 finished with value: 0.8835526690305923 and parameters: {'n_estimators': 282, 'max_depth': 45, 'min_samples_split': 5, 'min_samples_leaf': 1, 'max_features': 'log2', 'bootstrap': False}. Best is trial 24 with value: 0.8845933979034463.
2024-06-23 15:55:02,772 [INFO] Trial 38 finished with value: 0.8844096963212504 and parameters: {'n_estimators': 248, 'max_depth': 38, 'min_samples_split': 4, 'min_samples_leaf': 1, 'max_features': 'sqrt', 'bootstrap': False}. Best is trial 24 with value: 0.8845933979034463.
2024-06-23 15:57:47,640 [INFO] Trial 39 finished with value: 0.838124689276186 and parameters: {'n_estimators': 267, 'max_depth': 43, 'min_samples_split': 4, 'min_samples_leaf': 3, 'max_features': None, 'bootstrap': False}. Best is trial 24 with value: 0.8845933979034463.
2024-06-23 15:58:38,810 [INFO] Trial 40 finished with value: 0.8831240663643987 and parameters: {'n_estimators': 292, 'max_depth': 36, 'min_samples_split': 3, 'min_samples_leaf': 1, 'max_features': 'sqrt', 'bootstrap': False}. Best is trial 24 with value: 0.8845933979034463.
2024-06-23 15:59:23,096 [INFO] Trial 41 finished with value: 0.8846546114611741 and parameters: {'n_estimators': 261, 'max_depth': 41, 'min_samples_split': 4, 'min_samples_leaf': 1, 'max_features': 'sqrt', 'bootstrap': False}. Best is trial 41 with value: 0.8846546114611741.
2024-06-23 16:00:07,316 [INFO] Trial 42 finished with value: 0.8846546114611741 and parameters: {'n_estimators': 261, 'max_depth': 44, 'min_samples_split': 4, 'min_samples_leaf': 1, 'max_features': 'sqrt', 'bootstrap': False}. Best is trial 41 with value: 0.8846546114611741.
2024-06-23 16:00:48,926 [INFO] Trial 43 finished with value: 0.8844403194986944 and parameters: {'n_estimators': 254, 'max_depth': 44, 'min_samples_split': 4, 'min_samples_leaf': 1, 'max_features': 'sqrt', 'bootstrap': False}. Best is trial 41 with value: 0.8846546114611741.
2024-06-23 16:01:33,647 [INFO] Trial 44 finished with value: 0.8846240070249645 and parameters: {'n_estimators': 264, 'max_depth': 45, 'min_samples_split': 4, 'min_samples_leaf': 1, 'max_features': 'sqrt', 'bootstrap': False}. Best is trial 41 with value: 0.8846546114611741.
2024-06-23 16:02:22,880 [INFO] Trial 45 finished with value: 0.8847770713737901 and parameters: {'n_estimators': 263, 'max_depth': 45, 'min_samples_split': 4, 'min_samples_leaf': 1, 'max_features': 'sqrt', 'bootstrap': False}. Best is trial 45 with value: 0.8847770713737901.
2024-06-23 16:03:10,475 [INFO] Trial 46 finished with value: 0.8848076758099997 and parameters: {'n_estimators': 262, 'max_depth': 45, 'min_samples_split': 4, 'min_samples_leaf': 1, 'max_features': 'sqrt', 'bootstrap': False}. Best is trial 46 with value: 0.8848076758099997.
2024-06-23 16:03:43,287 [INFO] Trial 47 finished with value: 0.8775831406851543 and parameters: {'n_estimators': 245, 'max_depth': 45, 'min_samples_split': 5, 'min_samples_leaf': 1, 'max_features': 'log2', 'bootstrap': True}. Best is trial 46 with value: 0.8848076758099997.
2024-06-23 16:04:24,092 [INFO] Trial 48 finished with value: 0.8775525784167227 and parameters: {'n_estimators': 263, 'max_depth': 45, 'min_samples_split': 3, 'min_samples_leaf': 2, 'max_features': 'sqrt', 'bootstrap': False}. Best is trial 46 with value: 0.8848076758099997.
2024-06-23 16:04:54,221 [INFO] Trial 49 finished with value: 0.8803688706030662 and parameters: {'n_estimators': 230, 'max_depth': 44, 'min_samples_split': 4, 'min_samples_leaf': 1, 'max_features': 'sqrt', 'bootstrap': True}. Best is trial 46 with value: 0.8848076758099997.
2024-06-23 16:04:54,272 [INFO] Best hyperparameters: {'n_estimators': 262, 'max_depth': 45, 'min_samples_split': 4, 'min_samples_leaf': 1, 'max_features': 'sqrt', 'bootstrap': False}
2024-06-23 16:04:54,273 [INFO] Best value: 0.8848076758099997
